{
  "source": "rules",
  "stage": "matrix",
  "module": "contracts",
  "score": 88,
  "redline": false,
  "confidence": "high",
  "deductions": [
    {
      "rule": "matrix_fr_coverage",
      "points": 2,
      "evidence": "未覆盖 FR: ['FR-009']"
    },
    {
      "rule": "matrix_no_ac",
      "points": 10,
      "evidence": "矩阵中无 AC 编号"
    }
  ],
  "rule_engine_version": "1.0"
}